Title,Alternative Title,Description,Display Note,Creator,Creator ID,Publisher,Provider,Resource Class,Resource Type,Subject,Theme,Keyword,Language,B1G Language,Local Collection,Temporal Coverage,Date Issued,Index Year,Date Range,Spatial Coverage,Bounding Box,Geometry,Centroid,GeoNames,Coordinate Reference System,Spatial Resolution in Meters,Spatial Resolution as Text,Georeferenced,Provenance,Publication State,Website Platform,Endpoint URL,Endpoint Description,Is Harvested,Last Harvested,Accrual Method,Accrual Periodicity,Harvest Workflow,Created At,Updated At,Date Accessioned,Date Retired,Format,File Size,B1G Image,Member Of,Is Part Of,Source,Is Version Of,Replaces,Is Replaced By,Relation,Rights,License,Rights Holder,Access Rights,Suppressed Record,Deprioritized,Mediator,Access,ID,Identifier,WxS Identifier,Code,Tags,Admin Note
A vision of Britain through time,"","A vision of Britain between 1801 and 2001. Including maps, statistical trends and historical descriptions.|This collection contains shapefiles related to the Vision of Britain through Time project.","","","","Great Britain Historical GIS Project , Dept. of Geography, University of Portsmouth",Stanford,Websites,Interactive resources,Population,"","",eng,"","","",,"","",Great Britain,"-14.000,49.667,2.083,61.050","POLYGON((-14.000 61.050, 2.083 61.050, 2.083 49.667, -14.000 49.667, -14.000 61.050))","55.3585,-5.9585","","","","",,"",published,GeoBlacklight,https://github.com/OpenGeoMetadata/edu.stanford.purl,GitHub,,,Automated retrieval,,py_ogm_aardvark,2025-10-01 11:23:31 -0500,2026-03-29 19:14:02 -0500,2025-10-01,,,,,dc8c18df-7d64-4ff4-a754-d18d0891187d,"","","","","","","These data are licensed by Stanford Libraries and are available to Stanford University affiliates for non-commercial activities of research, teaching, educational or scholarly work purposes only. Affiliates are limited to current faculty, staff and students. An End User Licence outlining the full terms of use is included with this download.","","Copyright © Great Britain Historical GIS Project and the University of Portsmouth. By downloading any data from this site, you agree to the terms contained in the End User Licence.",Public,,,"",,stanford-jw176xm4375,https://purl.stanford.edu/jw176xm4375,,20d-0003,"",""
"Adams County, Illinois GIS","","Website for finding and accessing open data provided by Adams County, Illinois","",Illinois--Adams County,"",Illinois--Adams County,,Websites,Static web pages,County government records,"","",eng,"","",Continually updated resource,,"","",Illinois--Adams County|Illinois,"-91.513,39.757,-90.912,40.200","POLYGON((-91.513 40.200, -90.912 40.200, -90.912 39.757, -91.513 39.757, -91.513 40.200))","39.9785,-91.2125","","","","",,"",published,Other,https://www.adamscountygis.com,OneDrive,,,Manual curation,Yearly,template_website,2021-04-27 13:49:59 -0500,2026-04-15 18:02:37 -0500,2025-10-13,,,,,ba5cc745-21c5-4ae9-954b-72dd8db6815a,"","","","","","","","","",Public,,,"",,02b-17001,https://www.adamscountygis.com/,,w00_01,"",""
Allegheny County GIS Open Data,"","ArcGIS Hub site for finding and accessing open data provided by Allegheny County, Pennsylvania","","","",Pennsylvania--Allegheny County,,Websites,Data portals,County government records,"","",eng,"","",Continually updated resource,,"","",Pennsylvania--Allegheny County|Pennsylvania,"-80.361,40.194,-79.689,40.675","POLYGON((-80.361 40.675, -79.689 40.675, -79.689 40.194, -80.361 40.194, -80.361 40.675))","40.4345,-80.025","","","","",,"",published,ArcGIS Hub,https://openac-alcogis.opendata.arcgis.com/api/feed/dcat-us/1.1.json,DCAT API,true,2026-03-22,Automated retrieval,Weekly,py_arcgis_hub,2025-08-09 22:41:06 -0500,2026-03-29 17:46:44 -0500,,,,,,ba5cc745-21c5-4ae9-954b-72dd8db6815a,"","","","","","","","","",Public,,,"",,08b-42003,https://openac-alcogis.opendata.arcgis.com,,08b-42003,"",""
Allen County GIS Data Download Page,"","Website for finding and accessing open data provided by Allen County, Ohio","","","","",,Websites,Static web pages,County government records,"","",eng,"","",Continually updated resource,,"","",Ohio--Allen County|Ohio,"-84.397,40.643,-83.880,40.920","POLYGON((-84.397 40.920, -83.880 40.920, -83.880 40.643, -84.397 40.643, -84.397 40.920))","40.7815,-84.1385","","","","",,"",published,Other,https://gis.allencountyohio.com/GIS/downloads.Downloads page,Downloads page,,,Manual curation,Yearly,template_website,2021-04-27 13:50:00 -0500,2026-04-15 18:02:50 -0500,2025-10-27,,,,,ba5cc745-21c5-4ae9-954b-72dd8db6815a,"","","","","","","","","",Public,,,"",,11b-39003,https://gis.allencountyohio.com/GIS/downloads.Downloads page,,w00_01,"",""
ALPAGE,"","ALPAGE is a geohistorical platform about Paris. Based on a work dynamic initiated in 2006 with support from the French National Research Agency (ANR) this work then continued on beyond the funded phase (2006-2010). The initial project brought together twenty researchers in Social and Human Sciences and in Information and Communication Technology. Coordinated by Hélène Noizet, these historians, geomaticians and computer scientists have laid the foundations of a Geographic Information System (GIS) of the pre-industrial Parisian area. The spatial reference data, produced for the beginning of the 19th century and for the medieval period, have been made freely available online on a webmapping platform and is also available for download. A considerable amount of data has been produced not only on the medieval period but also on the modern period and on the 19th century. As regards to the geographical scale of the project, which remains limited to Paris, a partnership with the programme Archéologies du Bassin Parisien of the UMR 7041 ArScAn has enabled access to geohistorical frameworks across the Parisian basin.|Title taken from web site, viewed August 24, 2017.  <<""http://alpage.huma-num.fr/en/"">>|System requirements: Geographic Information Systems (GIS) software that reads ESRI shapefile format.","","","", ALPAGE,Stanford,Websites,"",Administrative and political divisions|Roads|Buildings,"","",eng,"","","",,"","",Paris (France),"2.224,48.816,2.470,48.902","POLYGON((2.224 48.902, 2.470 48.902, 2.470 48.816, 2.224 48.816, 2.224 48.902))","48.859,2.3470000000000004","","","","",,"",published,GeoBlacklight,https://github.com/OpenGeoMetadata/edu.stanford.purl,GitHub,,,Automated retrieval,,py_ogm_aardvark,2025-10-01 10:59:44 -0500,2026-03-29 19:15:34 -0500,2025-10-01,,File,,,dc8c18df-7d64-4ff4-a754-d18d0891187d,"","","","","","","This data is a direct result of the work of the researchers from the ALPAGE consortium who released this data under an Open Data Commons Open Database Licence (ODbL). Therefore, use of this data by others must respect the legal requirements specific to this licence. All freely downloadable data contains the shapefiles, metadata file and licence files describing the users rights and responsibilities. All data produced within the consortium is published in this way with the exception of any ongoing work which is in process of academic evaluation (masters, doctoral thesis, habilitation to supervise research).",https://opendatacommons.org/licenses/odbl/1-0/,Copyright resides with the originator.,Public,,,"",,stanford-zp399nk6394,https://purl.stanford.edu/zp399nk6394,,20d-0003,"",""
American Panorama,"","American Panorama is an historical atlas of the United States for the twenty-first century. It combines cutting-edge research with innovative interactive mapping techniques, designed to appeal to anyone with an interest in American history or a love of maps.","","Nelson, Robert K.|LaDale Winling","","Digital Scholarship Lab, University of Richmond",,Websites,Digital repositories,"","","",eng,"","","",,"","",United States,,"MULTIPOLYGON(((-178.44 28.52, -154.76 28.52, -154.76 18.86, -178.44 18.86, -178.44 28.52)),((-125.11 49.19, -66.66 49.19, -66.66 24.82, -125.11 24.82, -125.11 49.19)),((-179.3 51.1, -129.9 51.1, -129.9 71.5, -179.3 71.5, -179.3 51.1)))",,"","","","",,"",published,,,,true,2025-09-20,Manual curation,Irregular,template_children,2025-09-20 15:30:25 -0500,2026-03-29 19:55:43 -0500,,,,,,"","","","","","","","","","",Public,,,"",,20d-0005,https://dsl.richmond.edu/panorama/,,20d-0005,"",""
Ann Arbor Data Catalog,"","Website for finding and accessing open data provided by the City of Ann Arbor, Michigan","","","","",,Websites,Data portals,Municipal government records,"","",eng,"","",Continually updated resource,,"","",Michigan--Ann Arbor|Michigan,"-83.800,42.223,-83.676,42.324","POLYGON((-83.800 42.324, -83.676 42.324, -83.676 42.223, -83.800 42.223, -83.800 42.324))","42.2735,-83.738","","","","",,"",published,Other,https://www.a2gov.org/services/data-catalog/,CKAN API,,,Manual curation,Quarterly,py_ckan,2021-04-27 13:50:02 -0500,2026-04-15 18:02:33 -0500,2025-10-13,,,,,ba5cc745-21c5-4ae9-954b-72dd8db6815a,"","","","","","","","","",Public,,,"",,07c-02,https://www.a2gov.org/services/data-catalog/,,07c-02,"",2026-04-04 / Found new site Powered by PortalJS from Datopian.com. Could be harvested programmatically.
Anne Arundel County GIS Data,"","ArcGIS Hub site for finding and accessing open data provided by Anne Arundel County, Maryland","","","",Maryland--Anne Arundel County,,Websites,Data portals,County government records,"","",eng,"","",Continually updated resource,,"","",Maryland--Anne Arundel County|Maryland,"-76.840,38.713,-76.394,39.237","POLYGON((-76.840 39.237, -76.394 39.237, -76.394 38.713, -76.840 38.713, -76.840 39.237))","38.975,-76.617","","","","",,"",published,ArcGIS Hub,https://maps.aacounty.org/api/feed/dcat-us/1.1.json,DCAT API,true,2026-03-28,Automated retrieval,Weekly,py_arcgis_hub,2025-08-09 22:41:06 -0500,2026-03-29 15:13:09 -0500,,,,,,ba5cc745-21c5-4ae9-954b-72dd8db6815a,"","","","","","","","","",Public,,,"",,04b-24003,https://maps.aacounty.org,,04b-24003,"",""
Anoka County GIS Data Downloads,"","Website for finding and accessing open data provided by Anoka County, Minnesota","","","","",,Websites,Static web pages,County government records,"","",eng,"","",Continually updated resource,,"","",Minnesota--Anoka County|Minnesota,"-93.513,45.035,-93.018,45.415","POLYGON((-93.513 45.415, -93.018 45.415, -93.018 45.035, -93.513 45.035, -93.513 45.415))","45.224999999999994,-93.2655","","","","",,"",published,Other,https://www.anokacounty.us/1990/Data-Downloads,Downloads page,,,Manual curation,Yearly,template_website,2021-04-26 12:02:50 -0500,2026-04-15 18:02:41 -0500,2025-10-13,,,1.45 KB,,ba5cc745-21c5-4ae9-954b-72dd8db6815a,"","","","","","","","","",Public,,,"",,05b-27003,https://www.anokacounty.us/1990/Data-Downloads,,w00_01,"",""
Anti-Eviction Mapping Project,"","The Anti-Eviction Mapping Project is a data-visualization, data analysis, and storytelling collective documenting dispossession and resistance upon gentrifying landscapes. Primarily working in the San Francisco Bay Area, Los Angeles, and New York City, we are all volunteers producing digital maps, oral history work, film, murals, and community events. Working with a number of community partners and in solidarity with numerous housing movements, we study and visualize new entanglements of global capital, real estate, technocapitalism, and political economy. Our narrative oral history and video work centers the displacement of people and complex social worlds, but also modes of resistance. Maintaining antiracist and feminist analyses as well as decolonial methodology, the project creates tools and disseminates data contributing to collective resistance and movement building.","",San Francisco Tenants Union,"",San Francisco Tenants Union,,Websites,Interactive resources,Eviction|Housing,"","",eng,"","","",,"","",United States,"-125.102,23.998,-66.134,50.102","POLYGON((-125.102 50.102, -66.134 50.102, -66.134 23.998, -125.102 23.998, -125.102 50.102))","37.05,-95.618","","","","",,"",published,,,,,,Manual curation,Never,template_website,2022-03-01 14:27:18 -0600,2026-04-15 18:02:57 -0500,,,,48.9 KB,,"","","","","","","","","","",Public,,,"",,1da01b9b-4bfb-48fc-8444-ef61cab82bef,https://antievictionmap.com/,,w00_01,"",""
"ARC Research, Evaluations, Maps, and Data","","A collection of data and resources pertaining to the Appalachian Region, particularly critical socioeconomic issues.","",Appalachian Regional Commission,"",Appalachian Regional Commission,,Websites,Digital repositories,"","","",eng,"","","",,"","",Appalachia,"-91.39,30.72,-74.27,43.25","POLYGON((-91.39 43.25, -74.27 43.25, -74.27 30.72, -91.39 30.72, -91.39 43.25))","36.985,-82.83","","","","",,"",published,,,,,,Manual curation,Never,template_website,2023-10-17 13:41:09 -0500,2026-04-15 18:02:34 -0500,2025-08-23,,,6.55 KB,,"","","","","","","","","","",Public,,,"",,99-1600,https://www.arc.gov/research-evaluations-maps-data/,,w00_01,"",""
ArcGIS Living Atlas of the World,"","Living Atlas is a centralized platform where Esri offers authoritative, curated, and ready-to-use content can be utilized by the GIS community.","","","",Esri,,Websites,Interactive resources,"","","",eng,"","","",,"","","","-180.000,-90.000,180.000,90.000","ENVELOPE(-180,180,90,-90)","0.0,0.0","","","","",,"",published,,,Manual,,,Manual curation,As Needed,template_website,2021-04-13 13:28:21 -0500,2026-04-15 18:02:34 -0500,,,,,,b0153110-e455-4ced-9114-9b13250a7093,"","","","","","","","","",Public,,,"",,99-1200,https://livingatlas.arcgis.com/,,w00_01,"",""
ArcGIS Online at the University of Minnesota,"",Geospatial web services created by the University of Minnesota's U-Spatial,"",U-Spatial,"",University of Minnesota,University of Minnesota,Websites,Data portals,"","","",eng,"","","",,"","","","179.000,-75.000,-179.000,85.000","POLYGON((179.000 85.000, -179.000 85.000, -179.000 -75.000, 179.000 -75.000, 179.000 85.000))","5.0,0.0","","","","",,"",published,ArcGIS Online,https://umn.maps.arcgis.com/home/search.html?restrict=false&sortField=relevance&sortOrder=desc&searchTerm=owner%3A%22University_of_Minnesota%22#content,HTML,true,2025-08-24,Automated retrieval,Annual,py_arcgis_online,2022-01-20 16:42:40 -0600,2026-03-29 15:10:44 -0500,,,,,,"","","","","","","","","","",Public,,,"",,05d-07,https://umn.maps.arcgis.com,,05d-07,ogm,""
"Ashland County, WI GIS Open Data Portal","","ArcGIS Hub site for finding and accessing open data provided by Ashland County, Wisconsin","","","",Wisconsin--Ashland County,,Websites,Data portals,County government records,"","",eng,"","",Continually updated resource,,"","",Wisconsin--Ashland County|Wisconsin,"-90.928,45.980,-89.957,47.310","POLYGON((-90.928 47.310, -89.957 47.310, -89.957 45.980, -90.928 45.980, -90.928 47.310))","46.644999999999996,-90.4425","","","","",,"",published,ArcGIS Hub,https://data-ashlandcountywi.opendata.arcgis.com/api/feed/dcat-us/1.1.json,DCAT API,true,2026-03-22,Automated retrieval,Weekly,py_arcgis_hub,2025-08-09 22:41:06 -0500,2026-03-29 18:20:21 -0500,,,,,,ba5cc745-21c5-4ae9-954b-72dd8db6815a,"","","","","","","","","",Public,,,"",,10b-55003,https://data-ashlandcountywi.opendata.arcgis.com,,10b-55003,"",""
Athens County GIS Data,"","ArcGIS Hub site for finding and accessing open data provided by Athens County, Ohio","","","",Ohio--Athens County,,Websites,Data portals,County government records,"","",eng,"","",Continually updated resource,,"","",Ohio--Athens County|Ohio,"-82.298,39.181,-81.722,39.557","POLYGON((-82.298 39.557, -81.722 39.557, -81.722 39.181, -82.298 39.181, -82.298 39.557))","39.369,-82.00999999999999","","","","",,"",published,ArcGIS Hub,https://data-athgis.opendata.arcgis.com/api/feed/dcat-us/1.1.json,DCAT API,true,2026-03-22,Automated retrieval,Weekly,py_arcgis_hub,2025-08-09 22:41:06 -0500,2026-03-29 18:24:25 -0500,,,,,,ba5cc745-21c5-4ae9-954b-72dd8db6815a,"","","","","","","","","",Public,,,"",,11b-39009,https://data-athgis.opendata.arcgis.com,,11b-39009,"",""
Atlas of Rural and Small-Town America,"","The Atlas of Rural and Small-Town America provides statistics by broad categories of socioeconomic factors: People: Demographic data from the American Community Survey (ACS), including age, race and ethnicity, migration and immigration, education, household size, and family composition.; Jobs: Economic data from the Bureau of Labor Statistics and other sources, including information on employment trends, unemployment, and industrial composition of employment from the ACS.; County classifications: Categorical variables including the rural-urban continuum codes, economic dependence codes, persistent poverty, persistent child poverty, population loss, onshore oil/natural gas counties, and other ERS county typology codes.; Income: Data on median household income, per capita income, and poverty (including child poverty).; Veterans: Data on veterans, including service period, education, unemployment, income, and other demographic characteristics.","",U.S. Department of Agriculture,"","U.S. Department of Agriculture, Economic Research Service",,Websites,Interactive resources,"",Society|Economy,DEIA,eng,"","",2015-2021,2021,2015,2015-2021,United States,"-179.149,18.910,179.778,71.365","MULTIPOLYGON(((-178.44 28.52, -154.76 28.52, -154.76 18.86, -178.44 18.86, -178.44 28.52)),((-125.11 49.19, -66.66 49.19, -66.66 24.82, -125.11 24.82, -125.11 49.19)),((-179.3 51.1, -129.9 51.1, -129.9 71.5, -179.3 71.5, -179.3 51.1)),((172.3 51.2, 179.9 51.2, 179.9 53.1, 172.3 53.1, 172.3 51.2)))","45.137499999999996,0.31449999999999534","","","","",,"",published,,,,,,Manual curation,As Needed,template_website,2022-10-27 16:32:06 -0500,2026-04-15 18:03:00 -0500,,,,,,ba5cc745-21c5-4ae9-954b-72dd8db6815a,"","","","","","","","","",Public,,,"",,ac7f7a77-0be2-4d8c-a78a-681fea737855,https://www.ers.usda.gov/data-products/atlas-of-rural-and-small-town-america/,,w00_01,"",""
"Auglaize County, Ohio GIS Open Data Downloads","","Website for finding and accessing open data provided by Auglaize County, Ohio","","","","",,Websites,Static web pages,County government records,"","",eng,"","",Continually updated resource,,"","",Ohio--Auglaize County|Ohio,"-84.456,40.355,-83.880,40.686","POLYGON((-84.456 40.686, -83.880 40.686, -83.880 40.355, -84.456 40.355, -84.456 40.686))","40.5205,-84.168","","","","",,"",published,Other,https://augcogis.maps.arcgis.com/apps/PublicGallery/index.Downloads page?appid=8c6858fbb82042a6b72aa3b059433cdb,Downloads page,,,Manual curation,Yearly,template_website,2021-04-27 13:50:00 -0500,2026-04-15 18:02:51 -0500,2025-10-27,,,,,ba5cc745-21c5-4ae9-954b-72dd8db6815a,"","","","","","","","","",Public,,,"",,11b-39011,https://augcogis.maps.arcgis.com/apps/PublicGallery/index.Downloads page?appid=8c6858fbb82042a6b72aa3b059433cdb,,w00_01,"",""
Baltimore County Open Data Portal,"","ArcGIS Hub site for finding and accessing open data provided by Baltimore County, Maryland","","","",Maryland--Baltimore County,,Websites,Data portals,County government records,"","",eng,"","",Continually updated resource,,"","",Maryland--Baltimore County|Maryland,"-76.896,39.195,-76.333,39.721","POLYGON((-76.896 39.721, -76.333 39.721, -76.333 39.195, -76.896 39.195, -76.896 39.721))","39.458,-76.61449999999999","","","","",,"",published,ArcGIS Hub,https://opendata.baltimorecountymd.gov/api/feed/dcat-us/1.1.json,DCAT API,true,2026-03-28,Automated retrieval,Weekly,py_arcgis_hub,2025-08-09 22:41:06 -0500,2026-03-29 15:13:10 -0500,,,,,,ba5cc745-21c5-4ae9-954b-72dd8db6815a,"","","","","","","","","",Public,,,"",,04b-24005,https://opendata.baltimorecountymd.gov,,04b-24005,"",""
Bayfield County GIS Data Access,"","Website for finding and accessing open data provided by Bayfield County, Wisconsin","","","","",,Websites,Static web pages,County government records,"","",eng,"","",Continually updated resource,,"","",Wisconsin--Bayfield County|Wisconsin,"-91.554,46.155,-90.762,47.013","POLYGON((-91.554 47.013, -90.762 47.013, -90.762 46.155, -91.554 46.155, -91.554 47.013))","46.584,-91.158","","","","",,"",published,Other,https://www.bayfieldcounty.wi.gov/892/GIS-Data-Access,Downloads page,,,Manual curation,Yearly,template_website,2021-04-26 11:50:56 -0500,2026-04-15 18:02:45 -0500,2025-10-13,,,,,ba5cc745-21c5-4ae9-954b-72dd8db6815a,"","","","","","","","","",Public,,,"",,10b-55007,https://www.bayfieldcounty.wi.gov/892/GIS-Data-Access,,w00_01,"",""
Becker County GIS Data Downloads,"","Website for finding and accessing open data provided by Becker County, Minnesota","","","","",,Websites,Static web pages,County government records,"","",eng,"","",Continually updated resource,,"","",Minnesota--Becker County|Minnesota,"-96.195,46.715,-95.162,47.153","POLYGON((-96.195 47.153, -95.162 47.153, -95.162 46.715, -96.195 46.715, -96.195 47.153))","46.934,-95.6785","","","","",,"",published,Other,https://www.co.becker.mn.us/online_services/GIS_data.aspx,Downloads page,,,Manual curation,Yearly,template_website,2021-04-26 12:02:50 -0500,2026-04-15 18:02:41 -0500,2025-10-13,,,,,ba5cc745-21c5-4ae9-954b-72dd8db6815a,"","","","","","","","","",Public,,,"",,05b-27005,https://www.co.becker.mn.us/online_services/GIS_data.aspx,,w00_01,"",""
Beltrami County Open GIS Data,"","ArcGIS Hub site for finding and accessing open data provided by Beltrami County, Minnesota","","","",Minnesota--Beltrami County,,Websites,Data portals,County government records,"","",eng,"","",Continually updated resource,,"","",Minnesota--Beltrami County|Minnesota,"-95.603,47.410,-94.414,48.540","POLYGON((-95.603 48.540, -94.414 48.540, -94.414 47.410, -95.603 47.410, -95.603 48.540))","47.974999999999994,-95.0085","","","","",,"",published,ArcGIS Hub,https://bemidji-beltramicounty.opendata.arcgis.com/api/feed/dcat-us/1.1.json,DCAT API,true,2026-03-28,Automated retrieval,Weekly,py_arcgis_hub,2021-04-26 12:02:50 -0500,2026-03-29 15:13:10 -0500,,,,,,ba5cc745-21c5-4ae9-954b-72dd8db6815a,"","","","","","","","","",Public,,,"",,05b-27007,https://bemidji-beltramicounty.opendata.arcgis.com/,,05b-27007,"",""
Bend Open Data,"","ArcGIS Hub site for finding and accessing open data provided by the City of Bend, Oregon","","","",Oregon--Bend,,Websites,Data portals,Municipal government records,"","",eng,"","",Continually updated resource,,"","",Oregon--Bend|Oregon,"-122.000,43.610,-119.900,44.390","POLYGON((-121.1 44.17, -121.1 44.14, -120.99 44.13, -120.99 43.96, -120.75 43.96, -120.75 43.87, -120.38 43.87, -120.38 43.79, -120.26 43.79, -120.26 43.7, -119.9 43.7, -119.9 43.61, -122 43.62, -121.96 43.63, -121.99 43.65, -121.97 43.7, -121.98 43.74, -121.96 43.76, -121.98 43.86, -121.93 43.91, -121.87 43.91, -121.86 43.96, -121.84 43.97, -121.82 44.01, -121.83 44.04, -121.8 44.05, -121.77 44.1, -121.78 44.15, -121.77 44.17, -121.78 44.22, -121.79 44.25, -121.84 44.29, -121.84 44.39, -121.11 44.39, -121.1 44.17))","44.0,-120.95","","","","",,"",published,ArcGIS Hub,https://data.bendoregon.gov/api/feed/dcat-us/1.1.json,DCAT API,true,2026-03-28,Automated retrieval,Weekly,py_arcgis_hub,2025-08-09 22:41:06 -0500,2026-03-29 15:13:10 -0500,,,,,,ba5cc745-21c5-4ae9-954b-72dd8db6815a,"","","","","","","","","",Public,,,"",,17c-04,https://data.bendoregon.gov,,17c-04,"",""
Benton County GIS Data Downloads,"","Website for finding and accessing open data provided by Benton County, Minnesota","","","","",,Websites,Static web pages,County government records,"","",eng,"","",Continually updated resource,,"","",Minnesota--Benton County|Minnesota,"-94.353,45.559,-93.759,45.824","POLYGON((-94.353 45.824, -93.759 45.824, -93.759 45.559, -94.353 45.559, -94.353 45.824))","45.6915,-94.056","","","","",,"",published,Other,https://www.co.benton.mn.us/274/GIS-Mapping,Downloads page,,,Manual curation,Yearly,template_website,2021-04-26 12:02:50 -0500,2026-04-15 18:02:41 -0500,2025-10-13,,,,,ba5cc745-21c5-4ae9-954b-72dd8db6815a,"","","","","","","","","",Public,,,"",,05b-27009,https://www.co.benton.mn.us/274/GIS-Mapping,,w00_01,"",""
Benton County Open Data,"","ArcGIS Hub site for finding and accessing open data provided by Benton County, Washington","","","",Washington (State)--Benton County,,Websites,Data portals,County government records,"","",eng,"","",Continually updated resource,,"","",Washington (State)--Benton County|Washington (State),"-119.880,45.840,-118.940,46.730","POLYGON((-119.8 46.63, -119.71 46.65, -119.63 46.64, -119.52 46.73, -119.49 46.72, -119.45 46.69, -119.46 46.67, -119.41 46.65, -119.4 46.61, -119.27 46.52, -119.26 46.49, -119.27 46.37, -119.25 46.32, -119.27 46.27, -119.21 46.24, -119.11 46.22, -119.02 46.18, -118.97 46.13, -118.94 46.07, -118.94 46.03, -119.03 45.97, -119.13 45.93, -119.26 45.94, -119.49 45.91, -119.57 45.93, -119.62 45.91, -119.67 45.86, -119.87 45.84, -119.87 46.63, -119.8 46.63))","46.285,-119.41","","","","",,"",published,ArcGIS Hub,https://gisdata-bentonco.hub.arcgis.com/api/feed/dcat-us/1.1.json,DCAT API,true,2026-03-28,Automated retrieval,Weekly,py_arcgis_hub,2025-08-09 22:41:06 -0500,2026-03-29 15:13:11 -0500,,,,,,ba5cc745-21c5-4ae9-954b-72dd8db6815a,"","","","","","","","","",Public,,,"",,16b-55005,https://gisdata-bentonco.hub.arcgis.com,,16b-55005,"",""
Big Stone County Open Data,"","ArcGIS Hub site for finding and accessing open data provided by Big Stone County, Minnesota","","","",Minnesota--Big Stone County,,Websites,Data portals,County government records,"","",eng,"","",Continually updated resource,,"","",Minnesota--Big Stone County|Minnesota,"-96.835,45.177,-96.104,45.586","POLYGON((-96.835 45.586, -96.104 45.586, -96.104 45.177, -96.835 45.177, -96.835 45.586))","45.3815,-96.4695","","","","",,"",published,ArcGIS Hub,https://data-bigstonecounty.opendata.arcgis.com/api/feed/dcat-us/1.1.json,DCAT API,true,2026-03-28,Automated retrieval,Weekly,py_arcgis_hub,2025-08-09 22:41:06 -0500,2026-03-29 15:13:11 -0500,,,,,,ba5cc745-21c5-4ae9-954b-72dd8db6815a,"","","","","","","","","",Public,,,"",,05b-27011,https://data-bigstonecounty.opendata.arcgis.com,,05b-27011,"",""
