"Data Downloads for Coshocton County, Ohio","","Website for finding and accessing open data provided by Coshocton County, Ohio","","","","",,Websites,Static web pages,County government records,"","",eng,"","",Continually updated resource,,"","",Ohio--Coshocton County|Ohio,"-82.196,40.151,-81.616,40.456","POLYGON((-82.196 40.456, -81.616 40.456, -81.616 40.151, -82.196 40.151, -82.196 40.456))","40.3035,-81.906","","","","",,"",published,Other,https://www.coshoctoncounty.net/taxmap/gis-downloads,Downloads page,,,Manual curation,Yearly,template_website,2021-04-27 13:50:00 -0500,2026-04-15 18:02:51 -0500,2025-10-27,,,,,ba5cc745-21c5-4ae9-954b-72dd8db6815a,"","","","","","","","","",Public,,,"",,11b-39031,https://www.coshoctoncounty.net/taxmap/gis-downloads,,w00_01,"",""
"Data Downloads for Ottawa County, Ohio","","File service for finding and accessing open data provided by Ottawa County, Ohio","","","","",,Websites,Static web pages,County government records,"","",eng,"","",Continually updated resource,,"","",Ohio--Ottawa County|Ohio,"-83.416,41.457,-82.698,41.628","POLYGON((-83.416 41.628, -82.698 41.628, -82.698 41.457, -83.416 41.457, -83.416 41.628))","41.542500000000004,-83.05699999999999","","","","",,"",published,Other,http://ottawacountyauditor.org/site-links/gis-data-downloads/,Downloads page,,,Manual curation,Yearly,template_website,2021-04-27 13:50:00 -0500,2026-04-15 18:02:51 -0500,2025-10-27,,,,,ba5cc745-21c5-4ae9-954b-72dd8db6815a,"","","","","","","","","",Public,,,"",,11b-39123,http://ottawacountyauditor.org/site-links/gis-data-downloads/,,w00_01,"",""
Data Salem,"","ArcGIS Hub site for finding and accessing open data provided by the City of Salem, Oregon. DataSalem is your link to City of Salem, Oregon activity. You are welcome to discover, explore, analyze, and use this data and information. Data plays a key role in City decision-making and improves transparency, accountability, and customer service. Data can also be used to examine opportunities, challenges, and solutions, and to provide the basis for good decisions by individuals, businesses, and organizations.","","","",Oregon--Salem,,Websites,Data portals,Municipal government records,"","",eng,"","",Continually updated resource,,"","",Oregon--Salem|Oregon,"-123.180,44.680,-121.730,45.290","POLYGON((-123.18 45.29, -121.73 45.29, -121.73 44.68, -123.18 44.68, -123.18 45.29))","44.985,-122.45500000000001","","","","",,"",published,ArcGIS Hub,https://data.cityofsalem.net/api/feed/dcat-us/1.1.json,DCAT API,true,2026-03-28,Automated retrieval,Weekly,py_arcgis_hub,2025-08-09 22:41:06 -0500,2026-03-29 15:13:20 -0500,,,,,,ba5cc745-21c5-4ae9-954b-72dd8db6815a,"","","","","","","","","",Public,,,"",,17c-03,https://data.cityofsalem.net,,17c-03,"",""
"Data/Downloads for Belmont County, Ohio","","Website for finding and accessing open data provided by Belmont County, Ohio","","","","",,Websites,Static web pages,County government records,"","",eng,"","",Continually updated resource,,"","",Ohio--Belmont County|Ohio,"-81.237,39.850,-80.703,40.173","POLYGON((-81.237 40.173, -80.703 40.173, -80.703 39.850, -81.237 39.850, -81.237 40.173))","40.0115,-80.97","","","","",,"",published,Other,https://gis.browncountyengineer.org/gisweb/pages/downloads/BROWN-CO-DOWNLOADS.ASP,Downloads page,,,Manual curation,Yearly,template_website,2021-04-27 13:50:01 -0500,2026-04-15 18:02:51 -0500,2025-10-27,,,,,ba5cc745-21c5-4ae9-954b-72dd8db6815a,"","","","","","","","","",Public,,,"",,11b-39013,https://gis.browncountyengineer.org/gisweb/pages/downloads/BROWN-CO-DOWNLOADS.ASP,,w00_01,"",""
Dauphin County GIS Data Portal,"","ArcGIS Hub site for finding and accessing open data provided by Dauphin County, Pennsylvania","","","",Pennsylvania--Dauphin County,,Websites,Data portals,County government records,"","",eng,"","",Continually updated resource,,"","",Pennsylvania--Dauphin County|Pennsylvania,"-77.029,40.120,-76.535,40.660","POLYGON((-77.029 40.660, -76.535 40.660, -76.535 40.120, -77.029 40.120, -77.029 40.660))","40.39,-76.782","","","","",,"",published,ArcGIS Hub,https://data-dauphinco.opendata.arcgis.com/api/feed/dcat-us/1.1.json,DCAT API,true,2026-03-22,Automated retrieval,Weekly,py_arcgis_hub,2025-08-09 22:41:06 -0500,2026-03-29 17:47:39 -0500,,,,,,ba5cc745-21c5-4ae9-954b-72dd8db6815a,"","","","","","","","","",Public,,,"",,08b-42043,https://data-dauphinco.opendata.arcgis.com,,08b-42043,"",""
Defiance County GIS,"","Website for finding and accessing open data provided by Defiance County, Ohio","","","","",,Websites,Static web pages,County government records,"","",eng,"","",Continually updated resource,,"","",Ohio--Defiance County|Ohio,"-84.804,41.165,-84.227,41.428","POLYGON((-84.804 41.428, -84.227 41.428, -84.227 41.165, -84.804 41.165, -84.804 41.428))","41.296499999999995,-84.5155","","","","",,"",published,Other,https://www.defiance-county.com/engineer/GIS.htm,Downloads page,,,Manual curation,Yearly,template_website,2021-04-27 13:50:01 -0500,2026-04-15 18:02:52 -0500,2025-10-27,,,,,ba5cc745-21c5-4ae9-954b-72dd8db6815a,"","","","","","","","","",Public,,,"",,11b-39039,https://www.defiance-county.com/engineer/GIS.htm,,w00_01,"",""
Delaware County GIS,"","ArcGIS Hub site for finding and accessing open data provided by Delaware County, Ohio","","","",Ohio--Delaware County,,Websites,Data portals,County government records,"","",eng,"","",Continually updated resource,,"","",Ohio--Delaware County|Ohio,"-83.250,40.126,-82.745,40.444","POLYGON((-83.250 40.444, -82.745 40.444, -82.745 40.126, -83.250 40.126, -83.250 40.444))","40.285,-82.9975","","","","",,"",published,ArcGIS Hub,https://gisdata-delco.hub.arcgis.com/api/feed/dcat-us/1.1.json,DCAT API,true,2026-03-22,Automated retrieval,Weekly,py_arcgis_hub,2025-08-09 22:41:06 -0500,2026-03-29 18:24:38 -0500,,,,,,ba5cc745-21c5-4ae9-954b-72dd8db6815a,"","","","","","","","","",Public,,,"",,11b-39041,https://gisdata-delco.hub.arcgis.com,,11b-39041,"",""
Delaware Valley Regional Planning Commission (DVRPC),"",ArcGIS Hub site for finding and accessing open data provided by Delaware Valley Regional Planning Commission,"",Delaware Valley Regional Planning Commission,"",Pennsylvania,,Websites,Data portals,Intergovernment records,"","",eng,"","",Continually updated resource,,"","",Pennsylvania,"-77.137,38.830,-73.971,41.094","POLYGON((-77.137 41.094, -73.971 41.094, -73.971 38.830, -77.137 38.830, -77.137 41.094))","39.962,-75.554","","","","",,"",published,ArcGIS Hub,https://dvrpc-dvrpcgis.opendata.arcgis.com/api/feed/dcat-us/1.1.json,DCAT API,true,2026-03-28,Automated retrieval,Weekly,py_arcgis_hub,2025-08-09 22:41:06 -0500,2026-03-29 15:13:20 -0500,,,,,,ba5cc745-21c5-4ae9-954b-72dd8db6815a,"","","","","","","","","",Public,,,"",,04f-01,https://dvrpc-dvrpcgis.opendata.arcgis.com,,04f-01,"",""
Detroit Open Data,"","ArcGIS Hub site for finding and accessing open data provided by the City of Detroit, Michigan","","","",Michigan--Detroit,,Websites,Data portals,Municipal government records,"","",eng,"","",Continually updated resource,,"","",Michigan--Detroit|Michigan,"-83.288,42.255,-82.910,42.450","POLYGON((-83.288 42.450, -82.910 42.450, -82.910 42.255, -83.288 42.255, -83.288 42.450))","42.352500000000006,-83.09899999999999","","","","",,"",published,ArcGIS Hub,https://data.detroitmi.gov/api/feed/dcat-us/1.1.json,DCAT API,true,2026-03-22,Automated retrieval,Weekly,py_arcgis_hub,2025-08-09 22:41:06 -0500,2026-03-29 17:33:23 -0500,,,,,,ba5cc745-21c5-4ae9-954b-72dd8db6815a,"","","","","","","","","",Public,,,"",,07c-01,https://data.detroitmi.gov,,07c-01,"",""
Digital Sanborn Maps (Black & White) [All States] {1867-1970},"Digital Sanborn Maps, 1867-1970","ProQuest Digital Sanborn® Maps (1867–1970) is a subscription-based web application providing online access to digitized Sanborn fire insurance maps for more than 12,000 U.S. towns and cities. Access is restricted to authorized users and requires authentication through a subscribing institution. The platform delivers high-resolution, black-and-white digital scans derived from Library of Congress microfilm editions of the Sanborn Map Company’s printed volumes. Users can search by state, city, and date, browse available volumes, zoom and pan within sheets, and download map images (subject to licensing terms).|Sanborn maps were originally created for the fire insurance industry and depict detailed building-level information, including footprint outlines, construction materials, number of stories, building use, street names, property boundaries, block numbers, and other infrastructure features. Coverage varies by location and year. While many maps are in the public domain, some later sheets may remain under copyright; use and reproduction are governed by ProQuest’s licensing agreement and applicable copyright law.",Warning: Requires logging in through an organization with licensed access. Different institutions may have licenses for different years or locations.,Sanborn Map Company,"",ProQuest Information and Learning,,Websites,Interactive resources,"","",Sanborn,eng,"","",1867-1970,,1867,1867-1970,United States,"-179.9,-14.8,-64.4,71.6","MULTIPOLYGON(((-178.44 28.52, -154.76 28.52, -154.76 18.86, -178.44 18.86, -178.44 28.52)),((-125.11 49.19, -66.66 49.19, -66.66 24.82, -125.11 24.82, -125.11 49.19)),((-179.3 51.1, -129.9 51.1, -129.9 71.5, -179.3 71.5, -179.3 51.1)))","28.4,-122.15","","","","",,"",published,,,,true,2021-04-27,Manual curation,Annual,template_children,2024-06-20 16:04:49 -0500,2026-03-13 10:55:13 -0500,,,,,,999-licensed-resources,"","","","","",8888-001|8888-002,"","","",Restricted,,,University of Illinois Urbana-Champaign|Indiana University|University of Iowa|University of Maryland|University of Michigan|Northwestern University,,999-0011,"",,999-0011,"",""
DigitalCommons@University of Nebraska-Lincoln,"","This is a digital repository of research data, theses, dissertations, and journal articles.","",University of Nebraska-Lincoln,"","",University of Nebraska-Lincoln,Websites,Digital repositories,"","","",eng,"","","",,"","","",,,,"","","","",,"",published,HTML/JS,oai:digitalcommons.unl.edu,OAI-PMH,true,2025-09-19,Manual curation,Irregular,template_children,2021-05-24 10:18:25 -0500,2026-03-13 10:55:13 -0500,,,,4.14 KB,,dc8c18df-7d64-4ff4-a754-d18d0891187d,"","","","","","","","","",Public,,,"",,13d-01,https://digitalcommons.unl.edu/,,13d-01,ogm,""
"Discover Dane County, WI","","ArcGIS Hub site for finding and accessing open data provided by Dane County, Wisconsin","","","",Wisconsin--Dane County,,Websites,Data portals,County government records,"","",eng,"","",Continually updated resource,,"","",Wisconsin--Dane County|Wisconsin,"-89.567,42.998,-89.246,43.172","POLYGON((-89.567 43.172, -89.246 43.172, -89.246 42.998, -89.567 42.998, -89.567 43.172))","43.084999999999994,-89.4065","","","","",,"",published,ArcGIS Hub,https://gis-countyofdane.opendata.arcgis.com/api/feed/dcat-us/1.1.json,DCAT API,true,2026-03-22,Automated retrieval,Weekly,py_arcgis_hub,2025-08-09 22:41:06 -0500,2026-03-29 18:20:53 -0500,2025-09-03,2025-09-15,ArcGIS Hub,,https://lio.countyofdane.com/documents/images/lio-logo-50.png,ba5cc745-21c5-4ae9-954b-72dd8db6815a,"","","","","","","","","",Public,,,"",,10b-55025,https://gis-countyofdane.opendata.arcgis.com,,10b-55025,no children,"Hub site is working and API feed is working, but doesn't return any records. Published and marked is harvested = true for now. Maybe they will have records available later? Check Quarterly? -Cleo 2/1/26"
Diversity Data Kids,"","The site contains over 320 socio-economic and policy indicators capturing a wide range of topics. Many indicators are available for 10+ geographic summary levels, from national data down to the neighborhood-level, and cover the past ten years. Whenever possible, indicators were made available by race and ethnicity. ","",Institute for Equity in Child Opportunity & Healthy Development,"",Boston University School of Social Work,,Websites,Digital repositories,"",Health,DEIA,eng,"","","",,"","",United States,"-125.4,24.2,-64.4,49.6","MULTIPOLYGON(((-178.44 28.52, -154.76 28.52, -154.76 18.86, -178.44 18.86, -178.44 28.52)),((-125.11 49.19, -66.66 49.19, -66.66 24.82, -125.11 24.82, -125.11 49.19)),((-179.3 51.1, -129.9 51.1, -129.9 71.5, -179.3 71.5, -179.3 51.1)),((172.3 51.2, 179.9 51.2, 179.9 53.1, 172.3 53.1, 172.3 51.2)))","36.9,-94.9","","","","",,"",published,CKAN,None,None,,,Manual curation,Never,template_website,2022-11-02 21:43:07 -0500,2026-04-15 18:02:44 -0500,2025-08-23,,,,,b0153110-e455-4ced-9114-9b13250a7093,"","","","","","","","","",Public,,,"",,1000f-0004,https://data.diversitydatakids.org,,w00_01,"",""
Dividing the City: Race-Restrictive Covenants in St. Louis and St. Louis County,"","Dividing the City documents the scope, timing, and geography of private racial restrictions on property in St. Louis and St. Louis County."", ""To see the code and data behind the map of race-restrictive covenants in St. Louis and St. Louis County, Missouri, please click the following link: https://github.com/ui-libraries/greater-st-louis-covs","",Colin Gordon|Jay Bowen|University of Iowa Digital Scholarship and Publishing Studio,"",University of Iowa Digital Scholarship and Publishing Studio,University of Iowa,Websites,Interactive resources,"","","","","","","",,"","",Missouri--Saint Louis|Missouri--Saint Louis County|Missouri,"-90.736,38.386,-90.118,38.892","POLYGON((-90.736 38.892, -90.118 38.892, -90.118 38.386, -90.736 38.386, -90.736 38.892))","38.639,-90.42699999999999","","","","",,"",published,,,,,2023-05-11,Manual curation,Annual,template_children,2023-05-11 19:17:32 -0500,2026-03-29 19:55:43 -0500,,,,,,"","","","","","","","","","",Public,,,"",,b492921b-eebf-442f-acb4-1dc6b0d21cc8,"",,03d-02,"",""
Donald W. Hamer Center for Maps and Geospatial Information Digital Map Drawer of Penn State Rare Maps,"",The Donald W. Hamer Center for Maps and Geospatial Information digital map drawer contains the subset of our physical map collection that has been digitized and is not protected by licensing or copyright. It includes historical maps from around the world and an assortment of other historical Pennsylvania maps.,"",Pennsylvania State University,"","",Pennsylvania State University,Websites,Digital repositories,Map collections,"","",eng,"","","",,"","",Pennsylvania|World,"-180.000,-90.000,180.000,90.000","ENVELOPE(-180,180,90,-90)","0.0,0.0","","","","",,"",published,CONTENTdm,None,None,true,2021-04-27,Mediated deposit,Irregular,template_csv,2021-04-27 13:49:59 -0500,2026-03-29 17:50:54 -0500,,,,,,64bd8c4c-8e60-4956-b43d-bdc3f93db488,"","","","","","","","","",Public,,,"",,08d-01,https://libraries.psu.edu/about/collections/digital-map-drawer,,08d-01,ogm,""
Douglas County GIS Download,"","Website for finding and accessing open data provided by Douglas County, Wisconsin","","","","",,Websites,Static web pages,County government records,"","",eng,"","",Continually updated resource,,"","",Wisconsin--Douglas County|Wisconsin,"-92.294,46.157,-91.551,46.766","POLYGON((-92.294 46.766, -91.551 46.766, -91.551 46.157, -92.294 46.157, -92.294 46.766))","46.4615,-91.9225","","","","",,"",published,Other,https://www.ci.superior.wi.us/474/Geospatial-Data-GIS,Downloads page,,,Manual curation,Yearly,template_website,2021-04-26 11:51:13 -0500,2026-04-15 18:02:45 -0500,2025-10-27,,,,,ba5cc745-21c5-4ae9-954b-72dd8db6815a,"","","","","","","","","",Public,,,"",,10b-55031,https://www.ci.superior.wi.us/474/Geospatial-Data-GIS,,w00_01,"",""
Douglas County Mapping and Data Portal,"","ArcGIS Hub site for finding and accessing open data provided by Douglas County, WA.","","","",Washington (State)--Douglas County,,Websites,Data portals,County government records,"","",eng,"","",Continually updated resource,,"","",Washington (State)--Douglas County|Washington (State),"-120.320,47.220,-118.950,48.150","POLYGON((-120 47.31, -120 47.22, -120.08 47.23, -120.1 47.25, -120.09 47.34, -120.13 47.37, -120.29 47.39, -120.32 47.47, -120.29 47.54, -120.24 47.58, -120.24 47.63, -120.2 47.68, -120.22 47.72, -120.21 47.75, -120.13 47.78, -120.09 47.76, -119.99 47.78, -119.96 47.85, -119.92 47.87, -119.91 47.9, -119.86 47.94, -119.88 47.97, -119.87 48.01, -119.89 48.06, -119.78 48.09, -119.77 48.1, -119.72 48.08, -119.68 48.09, -119.67 48.07, -119.69 48.03, -119.62 48, -119.5 48.08, -119.44 48.08, -119.4 48.05, -119.34 48.05, -119.33 48.1, -119.31 48.11, -119.25 48.1, -119.13 48.15, -119.05 48.14, -119.03 48.11, -119.01 48.05, -118.95 48.02, -118.98 47.96, -119.1 47.96, -119.1 47.95, -119.13 47.95, -119.13 47.92, -119.21 47.89, -119.21 47.8, -120 47.31))","47.685,-119.63499999999999","","","","",,"",published,ArcGIS Hub,https://explore-douglas-county-data-douglaswa.hub.arcgis.com/api/feed/dcat-us/1.1.json,DCAT API,true,2026-03-28,Automated retrieval,Weekly,py_arcgis_hub,2025-08-09 22:41:06 -0500,2026-03-29 15:13:21 -0500,,,,,,ba5cc745-21c5-4ae9-954b-72dd8db6815a,"","","","","","","","","",Public,,,"",,16b-53017,https://explore-douglas-county-data-douglaswa.hub.arcgis.com,,16b-53017,"",""
Douglas County Open Data Portal,"","ArcGIS Hub site for finding and accessing open data provided by Douglas County, Minnesota","","","",Minnesota--Douglas County,,Websites,Data portals,County government records,"","",eng,"","",Continually updated resource,,"","",Minnesota--Douglas County|Minnesota,"-95.770,45.759,-95.139,46.108","POLYGON((-95.770 46.108, -95.139 46.108, -95.139 45.759, -95.770 45.759, -95.770 46.108))","45.933499999999995,-95.4545","","","","",,"",published,ArcGIS Hub,https://data-dcpw.opendata.arcgis.com/api/feed/dcat-us/1.1.json,DCAT API,true,2026-03-28,Automated retrieval,Weekly,py_arcgis_hub,2021-04-26 12:02:51 -0500,2026-03-29 15:13:21 -0500,,,,,,ba5cc745-21c5-4ae9-954b-72dd8db6815a,"","","","","","","","","",Public,,,"",,05b-27041,https://data-dcpw.opendata.arcgis.com/,,05b-27041,"",""
"Download GIS Data for Clermont County, Ohio","","Website for finding and accessing open data provided by Clermont County, Ohio","","","","",,Websites,Static web pages,County government records,"","",eng,"","",Continually updated resource,,"","",Ohio--Clermont County|Ohio,"-84.320,38.770,-83.993,39.271","POLYGON((-84.320 39.271, -83.993 39.271, -83.993 38.770, -84.320 38.770, -84.320 39.271))","39.0205,-84.1565","","","","",,"",published,Other,https://gis.clermontcountyohio.gov/download-gis-data/,Downloads page,,,Manual curation,Yearly,template_website,2021-04-27 13:50:01 -0500,2026-04-15 18:02:52 -0500,2025-10-27,,,,,ba5cc745-21c5-4ae9-954b-72dd8db6815a,"","","","","","","","","",Public,,,"",,11b-39025,https://gis.clermontcountyohio.gov/download-gis-data/,,w00_01,"",""
"Downloadable Files from Knox County, Ohio","","Website for finding and accessing open data provided by Knox County, Ohio","","","","Knox County, Ohio",,Websites,Static web pages,County government records,"","",eng,"","",Continually updated resource,,"","",Ohio--Knox County|Ohio,"-82.751,40.239,-82.179,40.573","POLYGON((-82.751 40.573, -82.179 40.573, -82.179 40.239, -82.751 40.239, -82.751 40.573))","40.406,-82.465","","","","",,"",published,Other,https://co.knox.oh.us/tax-map-and-gis/archive-and-downloads/,Downloads page,,,Manual curation,Yearly,template_website,2021-04-27 13:50:01 -0500,2026-04-15 18:02:52 -0500,2025-10-27,,,,,ba5cc745-21c5-4ae9-954b-72dd8db6815a,"","","","","","","","","",Public,,,"",,11b-39083,https://co.knox.oh.us/tax-map-and-gis/archive-and-downloads/,,w00_01,"",""
"Downloadable Maps and Data for Hocking County, Ohio","","Website for finding and accessing open data provided by Hocking County, Ohio","","","","",,Websites,Static web pages,County government records,"","",eng,"","",Continually updated resource,,"","",Ohio--Hocking County|Ohio,"-82.749,39.362,-82.159,39.662","POLYGON((-82.749 39.662, -82.159 39.662, -82.159 39.362, -82.749 39.362, -82.749 39.662))","39.512,-82.45400000000001","","","","",,"",published,Other,https://hocking.oh.gov/publicmaps/index.php,Downloads page,,,Manual curation,Yearly,template_website,2021-04-27 13:50:01 -0500,2026-04-15 18:02:52 -0500,2025-10-27,,,,,ba5cc745-21c5-4ae9-954b-72dd8db6815a,"","","","","","","","","",Public,,,"",,11b-39073,https://hocking.oh.gov/publicmaps/index.php,,w00_01,"",""
"Downloads for Crawford County, Ohio","","Website for finding and accessing open data provided by Crawford County, Ohio","","","","",,Websites,Static web pages,County government records,"","",eng,"","",Continually updated resource,,"","",Ohio--Crawford County|Ohio,"-83.113,40.703,-82.724,40.997","POLYGON((-83.113 40.997, -82.724 40.997, -82.724 40.703, -83.113 40.703, -83.113 40.997))","40.85,-82.9185","","","","",,"",published,Other,https://beacon.schneidercorp.com/Application.aspx?AppID=853&LayerID=16691&PageTypeID=16&PageID=7411&Q=291215914,Downloads page,,,Manual curation,Yearly,template_website,2021-04-27 13:50:01 -0500,2026-04-15 18:02:52 -0500,2025-10-27,,,,,ba5cc745-21c5-4ae9-954b-72dd8db6815a,"","","","","","","","","",Public,,,"",,11b-39033,https://beacon.schneidercorp.com/Application.aspx?AppID=853&LayerID=16691&PageTypeID=16&PageID=7411&Q=291215914,,w00_01,"",""
DuPage County GIS,"","ArcGIS Hub site for finding and accessing open data provided by DuPage County, Illinois","","","",Illinois--DuPage County,,Websites,Data portals,County government records,"","",eng,"","",Continually updated resource,,"","",Illinois--DuPage County|Illinois,"-88.263,41.685,-87.914,41.994","POLYGON((-88.263 41.994, -87.914 41.994, -87.914 41.685, -88.263 41.685, -88.263 41.994))","41.8395,-88.08850000000001","","","","",,"",published,ArcGIS Hub,https://gisdata-dupage.opendata.arcgis.com/api/feed/dcat-us/1.1.json,DCAT API,true,2026-03-22,Automated retrieval,Weekly,py_arcgis_hub,2025-08-09 22:41:06 -0500,2026-03-29 18:32:12 -0500,,,,,,ba5cc745-21c5-4ae9-954b-72dd8db6815a,"","","","","","","","","",Public,,,"",,12b-17043,https://gisdata-dupage.opendata.arcgis.com,,12b-17043,"",""
Early Modern Maps of the Americas,"",This collection features early maps of the Americas from the University of Chicago Map Collection.,"",University of Chicago,"","",University of Chicago,Websites,Digital repositories,Map collections,"",Early maps|World maps,eng,"","","",,"","",World,"-180.000,-90.000,180.000,90.000","ENVELOPE(-180,180,90,-90)","0.0,0.0","","","","",,"",published,Django,None,None,true,2021-04-27,Mediated deposit,Irregular,template_csv,2021-04-27 13:49:59 -0500,2026-03-29 18:34:37 -0500,,,,,,64bd8c4c-8e60-4956-b43d-bdc3f93db488,"","","","","","","","","",Public,,,"",,12d-02,https://www.lib.uchicago.edu/collex/collections/early-modern-maps-americas/,,12d-02,ogm,""
Earthstat,"",EarthStat serves geographic data sets that help solve the grand challenge of feeding a growing global population while reducing agriculture’s impact on the environment. EarthStat is a collaboration between the Global Landscapes Initiative at the University of Minnesota’s Institute on the Environment and the Land Use and Global Environment lab at the University of British Columbia.,"","","",Global Landscapes Initiative (GLI) at The University of Minnesota’s Institute on the Environment|Land Use and Global Environment (LUGE) lab at the University of British Columbia,,Websites,Static web pages,"","","",eng,"","",Continually updated resource,,"","","","-180.000,-90.000,180.000,90.000","ENVELOPE(-180,180,90,-90)","0.0,0.0","","","","",,"",published,Other,http://www.earthstat.org/,Downloads page,,,Manual curation,Yearly,template_website,2021-04-27 13:49:59 -0500,2026-04-15 18:02:43 -0500,2025-10-13,,,,,b0153110-e455-4ced-9114-9b13250a7093,"","","","","","","","","",Public,,,"",,05d-08,http://www.earthstat.org/,,w00_01,"",""
Earthworks,"",Earthworks is Stanford University Library's portal for discovery and distribution of geospatial data. Earthworks provides federated search of more than a dozen other research collections and direct access to data for download.,"",Stanford University Libraries,"",Stanford University Libraries,Stanford,Websites,Digital repositories,"","","",eng,"","","",,"","","",,,,"","","","",,"",published,GeoBlacklight,https://github.com/OpenGeoMetadata/edu.stanford.purl,GitHub,true,,Automated retrieval,As needed,py_ogm_aardvark,2025-08-24 14:58:04 -0500,2026-03-29 19:55:43 -0500,2025-08-24,,,,,"","","","","","","","","","",Public,,,"",,20d-0003,https://earthworks.stanford.edu,,20d-0003,"","Partially harvested - only adding public, nationwide or international datasets. (Not adding California records yet 0 2025-12-31)"
Eau Claire County Geospatial Hub,"","ArcGIS Hub site for finding and accessing open data provided by Eau Claire County, Wisconsin","","","",Wisconsin--Eau Claire County,,Websites,Data portals,County government records,"","",eng,"","",Continually updated resource,,"","",Wisconsin--Eau Claire County|Wisconsin,"-91.595,44.756,-91.368,44.879","POLYGON((-91.595 44.879, -91.368 44.879, -91.368 44.756, -91.595 44.756, -91.595 44.879))","44.817499999999995,-91.4815","","","","",,"",published,ArcGIS Hub,https://hub-eccounty.hub.arcgis.com/api/feed/dcat-us/1.1.json,DCAT API,true,2026-03-22,Automated retrieval,Weekly,py_arcgis_hub,2025-08-09 22:41:06 -0500,2026-03-29 18:20:54 -0500,,,,,,ba5cc745-21c5-4ae9-954b-72dd8db6815a,"","","","","","","","","",Public,,,"",,10b-55035-01,https://hub-eccounty.hub.arcgis.com,,10b-55035,"",""
