"Purdue Campus Maps: West Lafayette, Indiana, 1890-2014","","See Related Records below to download individual GeoTIFFs. The Purdue historical campus map collection was scanned and georeferenced by Purdue University Libraries. The physical maps were collected as Purdue University Campus Maps collection, located in the Virgina Kelly Karnes Archives and Special Collections, Purdue University Libraries. The collection details the growth of the Purdue University campus through the numerous campus maps, beginning with 1874 and ending with the most recent map. The map collection also provides an assortment of maps which focus on the unique features on campus. Copies of many of the campus maps can also be viewed via the Purdue University Libraries e-Archives: http://earchives.lib.purdue.edu/","","","","",Purdue University,Websites,Interactive resources,Map collections,"",Imagery and Base Maps,eng,"","",1890-2014,,1890,1890-1890,Indiana--West Lafayette|Indiana,"-86.936,40.402,-86.902,40.442","POLYGON((-86.936 40.442, -86.902 40.442, -86.902 40.402, -86.936 40.402, -86.936 40.442))","40.422,-86.91900000000001","","","","",,"",published,Custom HTML/JS,None,None,true,2021-05-07,Manual curation,Irregular,template_children,2021-05-07 17:56:38 -0500,2026-03-29 18:09:20 -0500,,,,,,64bd8c4c-8e60-4956-b43d-bdc3f93db488|dc8c18df-7d64-4ff4-a754-d18d0891187d,"","","","","","","","","",Public,,,"",,09d-02,https://collections.lib.purdue.edu/campus,,09d-02,"",""
Putnam County GIS Data,"","ArcGIS Hub site for finding and accessing open data provided by Putnam County, Ohio","","","",Ohio--Putnam County,,Websites,Data portals,County government records,"","",eng,"","",Continually updated resource,,"","",Ohio--Putnam County|Ohio,"-84.399,40.859,-83.880,41.168","POLYGON((-84.399 41.168, -83.880 41.168, -83.880 40.859, -84.399 40.859, -84.399 41.168))","41.0135,-84.1395","","","","",,"",published,ArcGIS Hub,https://home.putnamcountygis.com/api/feed/dcat-us/1.1.json,DCAT API,true,2026-03-22,Automated retrieval,Weekly,py_arcgis_hub,2021-04-27 13:50:02 -0500,2026-03-29 18:26:55 -0500,2025-12-15,,,,,ba5cc745-21c5-4ae9-954b-72dd8db6815a,"","","","","","","","","",Public,,,"",,11b-39137,https://home.putnamcountygis.com/,,11b-39137,no children,"Hub site is working and the harvest script doesn't return an error for this endpoint, but API feed is blank. Published and marked is harvested = true for now. Maybe they will have records available later? Check Quarterly? -Cleo, Feb 2026"
Racine County GIS Download,"","ArcGIS Hub site for finding and accessing open data provided by Racine County, Wisconsin","","","",Wisconsin--Racine County,,Websites,Data portals,County government records,"","",eng,"","",Continually updated resource,,"","",Wisconsin--Racine County|Wisconsin,"-88.308,42.611,-87.770,42.844","POLYGON((-88.308 42.844, -87.770 42.844, -87.770 42.611, -88.308 42.611, -88.308 42.844))","42.7275,-88.039","","","","",,"",published,ArcGIS Hub,http://data.racinecounty.opendata.arcgis.com/api/feed/dcat-us/1.1.json,DCAT API,true,2026-03-22,Automated retrieval,Weekly,py_arcgis_hub,2025-08-09 22:41:06 -0500,2026-03-29 18:21:43 -0500,,,,,,ba5cc745-21c5-4ae9-954b-72dd8db6815a,"","","","","","","","","",Public,,,"",,10b-55101,http://data.racinecounty.opendata.arcgis.com,,10b-55101,"",""
Ramsey County Open Data,"","ArcGIS Hub site for finding and accessing open data provided by Ramsey County, Minnesota","","","",Minnesota--Ramsey County,,Websites,Data portals,County government records,"","",eng,"","",Continually updated resource,,"","",Minnesota--Ramsey County|Minnesota,"-93.228,44.887,-92.984,45.125","POLYGON((-93.228 45.125, -92.984 45.125, -92.984 44.887, -93.228 44.887, -93.228 45.125))","45.006,-93.106","","","","",,"",published,ArcGIS Hub,https://data-ramseygis.opendata.arcgis.com/api/feed/dcat-us/1.1.json,DCAT API,true,2026-03-28,Automated retrieval,Weekly,py_arcgis_hub,2025-08-09 22:41:06 -0500,2026-03-29 15:13:40 -0500,,,,,,ba5cc745-21c5-4ae9-954b-72dd8db6815a,"","","","","","","","","",Public,,,"",,05b-27123,https://data-ramseygis.opendata.arcgis.com,,05b-27123,"",""
Redistricting Data Hub,"",The mission of the nonpartisan Redistricting Data Hub is to provide all the data necessary to draw and analyze state legislative and congressional redistricting maps. Data types include: Precinct-Level Election Results Joined with Precinct Boundaries; PL 94-171 (Decennial Census) and Other Official Population Data; American Community Survey Data; Citizen Voting Age Population Data; Population Projections; Voter File and Turnout Data; Official State Legislative and Congressional District Maps; Select Local Redistricting Data; and more.,"",Redistricting Data Hub,"",Redistricting Data Hub,,Websites,Digital repositories,"","","",eng,"","",Continually updated resource,,"","",United States,"144.4,-14.8,-64.4,71.6","POLYGON((144.4 71.6, -64.4 71.6, -64.4 -14.8, 144.4 -14.8, 144.4 71.6))","28.4,40.0","","","","",,"",published,Wordpress,,,,,Manual curation,Never,template_website,2022-05-27 15:42:55 -0500,2026-04-15 18:02:59 -0500,2025-08-24,,,,,"","","","","","","","","","",Public,,,"",,7c1c20e3-9a8a-4902-b7de-9062ea2f50c7,https://redistrictingdatahub.org,,w00_01,"",""
Renville County Open GIS Data,"","ArcGIS Hub site for finding and accessing open data provided by Renville County, Minnesota","","","",Minnesota--Renville County,,Websites,Data portals,County government records,"","",eng,"","",Continually updated resource,,"","",Minnesota--Renville County|Minnesota,"-95.484,44.456,-94.498,44.892","POLYGON((-95.484 44.892, -94.498 44.892, -94.498 44.456, -95.484 44.456, -95.484 44.892))","44.67400000000001,-94.991","","","","",,"",published,ArcGIS Hub,https://hub-renvilleco.hub.arcgis.com/api/feed/dcat-us/1.1.json,DCAT API,true,2026-03-28,Automated retrieval,Weekly,py_arcgis_hub,2025-08-09 22:41:06 -0500,2026-03-29 15:13:40 -0500,,,,,,ba5cc745-21c5-4ae9-954b-72dd8db6815a,"","","","","","","","","",Public,,,"",,05b-27129,https://hub-renvilleco.hub.arcgis.com,,05b-27129,"",""
RLIS Discovery,"","ArcGIS Hub site for finding and accessing open data for the Portland Oregon Metro Region. Since the inception of the Regional Land Information System (RLIS) in the late 1980s, Metro's Data Resource Center staff have worked with regional partners to collect and combine a wide array of data into a seamless dataset for use in regional decision-making.","","","",Oregon--Portland,,Websites,Data portals,Municipal government records,"","",eng,"","",Continually updated resource,,"","",Oregon--Portland|Oregon,"-122.930,45.430,-121.820,45.730","POLYGON((-122.48 45.46, -122.64 45.46, -122.66 45.46, -122.65 45.43, -122.74 45.43, -122.74 45.52, -122.76 45.52, -122.78 45.55, -122.87 45.59, -122.89 45.62, -122.91 45.62, -122.91 45.64, -122.93 45.64, -122.93 45.72, -122.76 45.73, -122.77 45.68, -122.76 45.66, -122.68 45.62, -122.44 45.56, -122.38 45.58, -122.3 45.54, -122.1 45.58, -121.92 45.65, -121.9 45.56, -121.92 45.55, -121.82 45.46, -122.48 45.46))","45.58,-122.375","","","","",,"",published,ArcGIS Hub,https://rlisdiscovery.oregonmetro.gov/api/feed/dcat-us/1.1.json,DCAT API,true,2026-03-28,Automated retrieval,Weekly,py_arcgis_hub,2025-08-09 22:41:06 -0500,2026-03-29 15:13:40 -0500,,,,,,ba5cc745-21c5-4ae9-954b-72dd8db6815a,"","","","","","","","","",Public,,,"",,17c-01,https://rlisdiscovery.oregonmetro.gov,,17c-01,"",""
Saint Louis County GIS & Mapping,"","ArcGIS Hub site for finding and accessing open data provided by St. Louis County, Minnesota","","","",Minnesota--St. Louis County,,Websites,Data portals,County government records,"","",eng,"","",Continually updated resource,,"","",Minnesota--St. Louis County|Minnesota,"-93.097,46.649,-91.789,48.632","POLYGON((-93.097 48.632, -91.789 48.632, -91.789 46.649, -93.097 46.649, -93.097 48.632))","47.6405,-92.443","","","","",,"",published,ArcGIS Hub,https://open-data-slcgis.hub.arcgis.com/api/feed/dcat-us/1.1.json,DCAT API,true,2026-03-28,Automated retrieval,Weekly,py_arcgis_hub,2025-08-09 22:41:06 -0500,2026-03-29 15:13:41 -0500,,,,,,ba5cc745-21c5-4ae9-954b-72dd8db6815a,"","","","","","","","","",Public,,,"",,05b-27137,https://open-data-slcgis.hub.arcgis.com,,05b-27137,"",""
"Sanborn Maps: Pennsylvania, 1884-1938","","The Sanborn Map Company, the best known of the U.S. fire-insurance map producers, has made maps since 1867. The fire insurance maps produced by Sanborn show building footprints, building material, height or number of stories, building use, lot lines, road widths and water facilities. The maps also show street names and property boundaries of the time. This collection of maps is historically significant as it is sometimes the best detailed map of a town or city dating from the mid 1800s. The Penn State University Libraries' Center for Maps and Geospatial Information has a near complete collection of Sanborn Fire Insurance maps for the state of Pennsylvania. The print collection can currently be accessed by contacting the Center staff.","",Pennsylvania State University,"","",Pennsylvania State University,Websites,Digital repositories,Map collections,"","",eng,"","",1884-1938,,1884,1884-1884,Pennsylvania,"-80.521,39.720,-74.689,42.515","POLYGON((-80.521 42.515, -74.689 42.515, -74.689 39.720, -80.521 39.720, -80.521 42.515))","41.1175,-77.60499999999999","","","","",,"",published,CONTENTdm,None,None,true,2021-04-27,Mediated deposit,Irregular,template_csv,2021-04-27 13:49:59 -0500,2026-03-29 17:59:43 -0500,,,,84 KB,,64bd8c4c-8e60-4956-b43d-bdc3f93db488,"","","","","","","","","",Public,,,"",,08d-02,https://libraries.psu.edu/about/collections/sanborn-fire-insurance-maps,,08d-02,ogm,""
Sarpy County GIS Portal,"","ArcGIS Hub site for finding and accessing open data provided by Sarpy County, Nebraska","","","",Nebraska--Sarpy County,,Websites,Data portals,County government records,"","",eng,"","",Continually updated resource,,"","",Nebraska--Sarpy County|Nebraska,"-96.339,40.996,-95.842,41.191","POLYGON((-96.339 41.191, -95.842 41.191, -95.842 40.996, -96.339 40.996, -96.339 41.191))","41.093500000000006,-96.09049999999999","","","","",,"",published,ArcGIS Hub,https://data2-sarpy.opendata.arcgis.com/api/feed/dcat-us/1.1.json,DCAT API,true,2026-03-28,Automated retrieval,Weekly,py_arcgis_hub,2025-08-09 22:41:06 -0500,2026-03-29 15:13:41 -0500,,,,,,ba5cc745-21c5-4ae9-954b-72dd8db6815a,"","","","","","","","","",Public,,,"",,13b-31153,https://data2-sarpy.opendata.arcgis.com,,13b-31153,"",""
SARS-ANI,"",This is the raw data and code repository of the SARS-ANI project on SARS-CoV-2 events in animals.,"",The World Organisation for Animal Health,"","",,Websites,Static web pages,"",Health,"",eng,"","",Continually updated resource,,"","","",,,,"","","","",,"",published,Other,https://github.com/amel-github/sars-ani,Downloads page,,,Manual curation,Yearly,template_website,2023-10-17 14:16:35 -0500,2026-04-15 18:02:35 -0500,2025-10-27,,,,,b0153110-e455-4ced-9114-9b13250a7093,"","","","","","","","","",Public,,,"",,99-1700,https://github.com/amel-github/sars-ani,,w00_01,"",""
Sauk County GIS Download,"","ArcGIS Hub site for finding and accessing open data provided by Sauk County, Wisconsin","","","",Wisconsin--Sauk County,,Websites,Data portals,County government records,"","",eng,"","",Continually updated resource,,"","",Wisconsin--Sauk County|Wisconsin,"-90.312,43.145,-89.599,43.642","POLYGON((-90.312 43.642, -89.599 43.642, -89.599 43.145, -90.312 43.145, -90.312 43.642))","43.3935,-89.9555","","","","",,"",published,ArcGIS Hub,https://data-saukgis.opendata.arcgis.com/api/feed/dcat-us/1.1.json,DCAT API,true,2026-03-22,Automated retrieval,Weekly,py_arcgis_hub,2025-08-09 22:41:06 -0500,2026-03-29 18:22:04 -0500,,,,,,ba5cc745-21c5-4ae9-954b-72dd8db6815a,"","","","","","","","","",Public,,,"",,10b-55111,https://data-saukgis.opendata.arcgis.com,,10b-55111,"",""
Scott County GIS Data,"","Website for finding and accessing open data provided by Scott County, Iowa","","","","",,Websites,Static web pages,County government records,"","",eng,"","",Continually updated resource,,"","",Iowa--Scott County|Iowa,"-90.900,41.450,-90.313,41.776","POLYGON((-90.900 41.776, -90.313 41.776, -90.313 41.450, -90.900 41.450, -90.900 41.776))","41.613,-90.60650000000001","","","","",,"",published,Other,https://www.scottcountyiowa.com/it/data,Downloads page,,,Manual curation,Yearly,template_website,2021-04-26 10:56:28 -0500,2026-04-15 18:02:39 -0500,2025-10-13,,,,,ba5cc745-21c5-4ae9-954b-72dd8db6815a,"","","","","","","","","",Public,,,"",,03b-19163,https://www.scottcountyiowa.com/it/data,,w00_01,"",""
Scott County Open Data,"","ArcGIS Hub site for finding and accessing open data provided by Scott County, Minnesota","","","",Minnesota--Scott County,,Websites,Data portals,County government records,"","",eng,"","",Continually updated resource,,"","",Minnesota--Scott County|Minnesota,"-93.912,44.545,-93.278,44.814","POLYGON((-93.912 44.814, -93.278 44.814, -93.278 44.545, -93.912 44.545, -93.912 44.814))","44.679500000000004,-93.595","","","","",,"",published,ArcGIS Hub,https://open-data-scottcounty.hub.arcgis.com/api/feed/dcat-us/1.1.json,DCAT API,true,2026-03-28,Automated retrieval,Weekly,py_arcgis_hub,2025-08-09 22:41:06 -0500,2026-03-29 15:13:41 -0500,,,,,,ba5cc745-21c5-4ae9-954b-72dd8db6815a,"","","","","","","","","",Public,,,"",,05b-27139,https://open-data-scottcounty.hub.arcgis.com,,05b-27139,"",""
Seattle GeoData,"","ArcGIS Hub site for finding and accessing open data provided by the City of Seattle, Washington","","","",Washington (State)--Seattle,,Websites,Data portals,Municipal government records,"","",eng,"","",Continually updated resource,,"","",Washington (State)--Seattle|Washington (State),"-122.460,47.481,-122.224,47.734","POLYGON((-122.459681 47.73415, -122.224433 47.73415, -122.224433 47.481002, -122.459681 47.481002, -122.459681 47.73415))","47.6075,-122.342","","","","",,"",published,ArcGIS Hub,https://data-seattlecitygis.opendata.arcgis.com/api/feed/dcat-us/1.1.json,DCAT API,true,2026-03-28,Automated retrieval,Weekly,py_arcgis_hub,2025-08-09 22:41:06 -0500,2026-03-29 15:13:42 -0500,,,,,,ba5cc745-21c5-4ae9-954b-72dd8db6815a,"","","","","","","","","",Public,,,"",,16c-01,https://data-seattlecitygis.opendata.arcgis.com,,16c-01,"",""
SEMCOG Open Data,"","ArcGIS Hub site for finding and accessing open data provided by SEMCOG, Southeast Michigan Council of Governments","","SEMCOG, Southeast Michigan Council of Governments","",Michigan,,Websites,Data portals,Intergovernment records,"","",eng,"","",Continually updated resource,,"","",Michigan,"-84.158,41.724,-82.418,43.169","POLYGON((-84.158 43.169, -82.418 43.169, -82.418 41.724, -84.158 41.724, -84.158 43.169))","42.4465,-83.28800000000001","","","","",,"",published,ArcGIS Hub,http://maps-semcog.opendata.arcgis.com/api/feed/dcat-us/1.1.json,DCAT API,true,2026-03-22,Automated retrieval,Weekly,py_arcgis_hub,2025-08-09 22:41:06 -0500,2026-03-29 17:33:01 -0500,,,,,,ba5cc745-21c5-4ae9-954b-72dd8db6815a,"","","","","","","","","",Public,,,"",,06f-01,http://maps-semcog.opendata.arcgis.com,,06f-01,"",""
Seneca County GeoLibrary,"","ArcGIS Hub site for finding and accessing open data provided by Seneca County, Ohio","","","",Ohio--Seneca County,,Websites,Data portals,County government records,"","",eng,"","",Continually updated resource,,"","",Ohio--Seneca County|Ohio,"-83.421,40.992,-82.830,41.257","POLYGON((-83.421 41.257, -82.830 41.257, -82.830 40.992, -83.421 40.992, -83.421 41.257))","41.1245,-83.1255","","","","",,"",published,ArcGIS Hub,https://portal-senecacountygis.hub.arcgis.com/api/feed/dcat-us/1.1.json,DCAT API,true,2026-03-22,Automated retrieval,Weekly,py_arcgis_hub,2021-04-27 13:50:02 -0500,2026-03-29 18:24:54 -0500,,,,,,ba5cc745-21c5-4ae9-954b-72dd8db6815a,"","","","","","","","","",Public,,,"",,11b-39047,https://portal-senecacountygis.hub.arcgis.com/,,11b-39047,"",""
Sheboygan County GIS Download,"","Website for finding and accessing open data provided by Washington County, Minnesota","","","","",,Websites,"",County government records,"","",eng,"","",Continually updated resource,,"","",Wisconsin--Sheboygan County|Wisconsin,"-88.162,43.542,-87.696,43.892","POLYGON((-88.162 43.892, -87.696 43.892, -87.696 43.542, -88.162 43.542, -88.162 43.892))","43.717,-87.929","","","","",,"",published,,,Manual,,,Manual curation,Never,template_website,2021-04-26 11:54:01 -0500,2026-04-15 18:02:48 -0500,,,,,,ba5cc745-21c5-4ae9-954b-72dd8db6815a,"","","","","","","","","",Public,,,"",,10b-55117,https://data-shebco.opendata.arcgis.com/,,w00_01,"",""
Sherburne County Open Data,"","ArcGIS Hub site for finding and accessing open data provided by Sherburne County, Minnesota","","","",Minnesota--Sherburne County,,Websites,Data portals,County government records,"","",eng,"","",Continually updated resource,,"","",Minnesota--Sherburne County|Minnesota,"-94.150,45.246,-93.510,45.560","POLYGON((-94.150 45.560, -93.510 45.560, -93.510 45.246, -94.150 45.246, -94.150 45.560))","45.403000000000006,-93.83000000000001","","","","",,"",published,ArcGIS Hub,https://data-sherburnegis.opendata.arcgis.com/api/feed/dcat-us/1.1.json,DCAT API,true,2026-03-28,Automated retrieval,Weekly,py_arcgis_hub,2025-08-09 22:41:06 -0500,2026-03-29 15:13:42 -0500,,,,,,ba5cc745-21c5-4ae9-954b-72dd8db6815a,"","","","","","","","","",Public,,,"",,05b-27141,https://data-sherburnegis.opendata.arcgis.com,,05b-27141,"",""
SimplyAnalytics,"","Formerly named SimplyMap, SimplyAnalytics is a web-based mapping tool that lets users quickly create professional-quality thematic maps and reports using powerful demographic, business, and marketing data. Maps are exportable as shapefiles.",Warning: Requires logging in through an organization with licensed access. Different institutions may have licenses for different years or locations.,"Geographic Research, Inc.",null,"",,Websites,Interactive resources,"",Economy,Simply Analytics|2022-creator-sprint,eng,"","",1980-present,,1980,1980-2021,United States,"-179.9,-14.8,-64.4,71.6","POLYGON((-179.9 71.6, -64.4 71.6, -64.4 -14.8, -179.9 -14.8, -179.9 71.6))","28.4,-122.15","","","","",,"",published,,,,true,2020-11-18,Manual curation,Annual,template_children,2021-04-27 15:43:13 -0500,2026-03-13 10:55:42 -0500,,,,,,999-licensed-resources,"","","","","",8888-001,"","","",Restricted,,,University of Illinois Urbana-Champaign|Indiana University|University of Iowa|University of Maryland|University of Michigan|Michigan State University|University of Minnesota|Pennsylvania State University|Purdue University|Michigan State University,,999-0004,"",,999-0004,"",""
Snohomish County Open Data Portal,"","ArcGIS Hub site for finding and accessing open data provided by Snohomish County, Washington","","","",Washington (State)--Snohomish County,,Websites,Data portals,County government records,"","",eng,"","",Continually updated resource,,"","",Washington (State)--Snohomish County|Washington (State),"-122.460,47.780,-120.910,48.300","MultiPolygon (((-122.46 48.3, -121 48.3, -121.01 48.28, -120.96 48.23, -120.96 48.21, -120.92 48.19, -120.91 48.16, -120.96 48.15, -120.97 48.13, -120.95 48.11, -121.02 48.07, -121.15 48.04, -121.12 48, -121.16 47.96, -121.18 47.9, -121.16 47.88, -121.15 47.85, -121.07 47.83, -121.12 47.78, -122.44 47.78, -122.43 47.83, -122.36 47.89, -122.33 47.96, -122.35 48.01, -122.35 48.07, -122.42 48.16, -122.39 48.24, -122.46 48.3)))","48.04,-121.685","","","","",,"",published,ArcGIS Hub,https://snohomish-county-open-data-portal-snoco-gis.hub.arcgis.com/api/feed/dcat-us/1.1.json,DCAT API,true,2026-03-28,Automated retrieval,Weekly,py_arcgis_hub,2025-08-09 22:41:06 -0500,2026-03-29 15:13:42 -0500,,,,,,ba5cc745-21c5-4ae9-954b-72dd8db6815a,"","","","","","","","","",Public,,,"",,16b-53061,https://snohomish-county-open-data-portal-snoco-gis.hub.arcgis.com,,16b-53061,"",""
Social Explorer,"","This interactive website allows users to create maps and reports from selected census statistics. 1790 to 1930: County, state and national data. 1940-2000: Census tract, county, state and national data. 2006- : ACS. Also includes religion data, U.S. Election data, UK Census 2011 data, and Ireland Religion data. Generate thematic maps for census tracts. It offers a growing selection of shapefile downloads.",Warning: Requires logging in through an organization with licensed access. Different institutions may have licenses for different years or locations.,"","",Queens College Department of Sociology,,Websites,Interactive resources,Census,Society,SocialExplorer|Social|Explorer,eng,"","",1790-present,,1790,1790-2021,United States,"-179.9,-14.8,-64.4,71.6","POLYGON((-179.9 71.6, -64.4 71.6, -64.4 -14.8, -179.9 -14.8, -179.9 71.6))","28.4,-122.15","","","","",,"",published,,,,true,2021-04-27,Manual curation,Irregular,template_children,2021-04-27 15:42:46 -0500,2026-03-13 10:55:43 -0500,,,,,,999-licensed-resources,"","","","","",8888-001,"","","",Restricted,,,University of Chicago|University of Illinois Urbana-Champaign|Indiana University|University of Iowa|University of Maryland|University of Michigan|Michigan State University|University of Minnesota|The Ohio State University|Pennsylvania State University|Rutgers University-New Brunswick|University of Wisconsin-Madison,,999-0001,"",,999-0001,"",""
Social Scientists Map Chicago Collection,"","All of these maps (even those that say ""Dept. of Sociology"") were produced under the aegis of the Social Science Research Committee or its immediate predecessor, the Local Community Research Committee. Funded by the Laura Spelman Rockefeller Memorial, this entity particularly focused on supporting Chicago research. It is not clear who actually made the maps, although Ernest W. Burgess was definitely among those who administered the analysis of the data that underlay them. The maps were republished by the University of Chicago Press in Census Data of the City of Chicago, 1920 (1931), Census Data of the City of Chicago, 1930 (1933), and Census Data for the City of Chicago, 1934 (1934), although the versions used in the construction of this Web site are earlier editions published as separate pieces and held at the University of Chicago Map Collection. All of these maps (even those that say ""Dept. of Sociology"") were produced under the aegis of the Social Science Research Committee or its immediate predecessor, the Local Community Research Committee. Funded by the Laura Spelman Rockefeller Memorial, this entity particularly focused on supporting Chicago research. It is not clear who actually made the maps, although Ernest W. Burgess was definitely among those who administered the analysis of the data that underlay them. The maps were republished by the University of Chicago Press in Census Data of the City of Chicago, 1920 (1931), Census Data of the City of Chicago, 1930 (1933), and Census Data for the City of Chicago, 1934 (1934), although the versions found here are earlier editions published as separate pieces and held at the University of Chicago Map Collection. The maps were scanned at 360 dpi using NextImage software and were saved as tiff files","",University of Chicago,"","",University of Chicago,Websites,Digital repositories,Map collections,"","",eng,"","",1873-1956,,1873,1873-1873,Illinois--Chicago|Illinois,"-87.940,41.644,-87.524,42.023","POLYGON((-87.940 42.023, -87.524 42.023, -87.524 41.644, -87.940 41.644, -87.940 42.023))","41.8335,-87.732","","","","",,"",published,Django,None,None,true,2021-04-27,Mediated deposit,Irregular,template_csv,2021-04-27 13:49:59 -0500,2026-03-29 18:34:33 -0500,,,,,,64bd8c4c-8e60-4956-b43d-bdc3f93db488,"","","","","","","","","",Public,,,"",,12d-01,https://www.lib.uchicago.edu/collex/collections/social-scientists-map-chicago/,,12d-01,ogm,""
"South Bend, IN Open Data","","ArcGIS Hub site for finding and accessing open data provided by South Bend, Indiana","","","",Indiana--South Bend,,Websites,Data portals,Municipal government records,"","",eng,"","",Continually updated resource,,"","",Indiana--South Bend|Indiana,"-86.361,41.597,-86.191,41.760","POLYGON((-86.361 41.760, -86.191 41.760, -86.191 41.597, -86.361 41.597, -86.361 41.760))","41.6785,-86.27600000000001","","","","",,"",published,ArcGIS Hub,http://data-southbend.opendata.arcgis.com/api/feed/dcat-us/1.1.json,DCAT API,true,2026-03-22,Automated retrieval,Weekly,py_arcgis_hub,2025-08-09 22:41:06 -0500,2026-03-29 18:09:05 -0500,,,,,,ba5cc745-21c5-4ae9-954b-72dd8db6815a,"","","","","","","","","",Public,,,"",,09c-01,http://data-southbend.opendata.arcgis.com,,09c-01,"",""
"Spatial Data for Brown County, Ohio","","County website containing downloadable shapefiles for addresses, boundaries, parcels, features, elevation, hydrology, centerlines, and districts.","",Brown County Engineer's Office,"",Ohio--Brown County,,Websites,Static web pages,County government records,"",Counties geospatial data,eng,"","",Continually updated resource,,"","",Ohio--Brown County|Ohio,"-84.053,38.640,-83.673,39.254","POLYGON((-84.053 39.254, -83.673 39.254, -83.673 38.640, -84.053 38.640, -84.053 39.254))","38.947,-83.863","","","","",,"",published,Other,https://gis.browncountyengineer.org/gisweb/pages/downloads/BROWN-CO-DOWNLOADS.ASP,Downloads page,,,Manual curation,Yearly,template_website,2021-04-27 13:50:02 -0500,2026-04-15 18:02:56 -0500,2025-10-27,,,,,ba5cc745-21c5-4ae9-954b-72dd8db6815a,"","","","","","","","","",Public,,,"",,11b-39015,https://gis.browncountyengineer.org/gisweb/pages/downloads/BROWN-CO-DOWNLOADS.ASP,,w00_01,"",""
